{
  "$schema": "./speech-language-support.schema.json",
  "sottoLanguageCodes": [
    "en",
    "es",
    "fr",
    "de",
    "pt",
    "it",
    "ja",
    "ko",
    "zh",
    "ar",
    "hi",
    "ru",
    "nl",
    "sv",
    "pl",
    "tr",
    "da",
    "fi",
    "no",
    "cs",
    "ro",
    "hu",
    "el",
    "he",
    "th",
    "vi",
    "id",
    "ms",
    "uk",
    "ca"
  ],
  "ttsLanguageSupport": {
    "elevenLabsMultilingualV2": [
      "en",
      "es",
      "fr",
      "de",
      "pt",
      "it",
      "ja",
      "ko",
      "zh",
      "ar",
      "hi",
      "ru",
      "nl",
      "sv",
      "pl",
      "tr",
      "da",
      "fi",
      "cs",
      "ro",
      "hu",
      "el",
      "id",
      "ms"
    ],
    "elevenLabsFlash": [
      "en",
      "es",
      "fr",
      "de",
      "pt",
      "it",
      "ja",
      "ko",
      "zh",
      "ar",
      "hi",
      "ru",
      "nl",
      "sv",
      "pl",
      "tr",
      "da",
      "fi",
      "no",
      "cs",
      "ro",
      "hu",
      "el",
      "he",
      "vi",
      "id",
      "ms"
    ],
    "cartesiaSonic3": [
      "en",
      "es",
      "fr",
      "de",
      "pt",
      "it",
      "ja",
      "ko",
      "zh",
      "ar",
      "hi",
      "ru",
      "nl",
      "sv",
      "pl",
      "tr",
      "da",
      "fi",
      "no",
      "cs",
      "ro",
      "hu",
      "el",
      "he",
      "th",
      "vi",
      "id",
      "ms"
    ],
    "cartesiaTurbo": [
      "en",
      "es",
      "fr",
      "de",
      "pt",
      "it",
      "ja",
      "ko",
      "zh",
      "ar",
      "hi",
      "ru",
      "nl",
      "sv",
      "pl"
    ],
    "humeV2": ["en", "es", "fr", "de", "pt", "it", "ja", "ko", "zh", "hi", "ru"],
    "humeV1": ["en", "es"],
    "qwen3": ["en", "es", "fr", "de", "ja", "ko", "zh", "it", "pt", "ru"],
    "mistral": ["en", "es", "fr", "de", "pt", "it", "ja", "ko", "zh"],
    "inworld": [
      "en",
      "es",
      "fr",
      "de",
      "pt",
      "it",
      "ja",
      "ko",
      "zh",
      "ar",
      "hi",
      "ru",
      "nl",
      "sv",
      "pl"
    ],
    "kokoro": ["en", "es", "fr", "hi", "it", "pt", "ja", "zh"],
    "deepgramAura": ["en", "es", "de", "fr", "nl", "it", "ja"],
    "rimeArcana": ["en", "es", "fr", "de", "hi", "he", "ja", "pt", "ar"],
    "playhtPlay3Mini": [
      "en",
      "es",
      "fr",
      "de",
      "pt",
      "it",
      "ja",
      "ko",
      "zh",
      "ar",
      "hi",
      "ru",
      "nl",
      "sv",
      "pl",
      "tr",
      "da",
      "cs",
      "hu",
      "el",
      "he",
      "th",
      "id",
      "ms",
      "uk",
      "ca"
    ]
  },
  "sttLanguageSupport": {
    "assemblyUniversal3Pro": ["en", "es", "fr", "de", "pt", "it"],
    "inkTwo": ["en"],
    "deepgramNova2": [
      "en",
      "es",
      "fr",
      "de",
      "pt",
      "it",
      "ja",
      "ko",
      "zh",
      "hi",
      "ru",
      "nl",
      "sv",
      "pl",
      "tr",
      "da",
      "fi",
      "no",
      "cs",
      "hu",
      "el",
      "th",
      "vi",
      "id",
      "ms",
      "uk",
      "ca"
    ],
    "gladiaSolaria3": ["en", "fr", "de", "es", "it"]
  },
  "welcomeProviderLanguageSupport": {
    "tts": {
      "elevenlabs": "all",
      "hume": "humeV2",
      "openai": "all",
      "cartesia": "cartesiaSonic3",
      "fish": "all",
      "deepgram": "deepgramAura",
      "rime": "rimeArcana",
      "playht": "playhtPlay3Mini",
      "kokoro": "kokoro",
      "local": "all"
    },
    "stt": {
      "whisper": "all",
      "local": "all",
      "deepgram": "all",
      "elevenlabs": "all",
      "assembly": "all",
      "assemblyai": "all",
      "openai": "all",
      "together": "all",
      "cartesia": "all",
      "groq": "all",
      "gladia": "all",
      "speechmatics": "all"
    }
  },
  "sttProviderLanguageCodeOverrides": {
    "speechmatics": {
      "zh": "cmn"
    }
  },
  "languageAliasesToSotto": {
    "cmn": "zh"
  }
}
